{
  "contract_version": "1.0",
  "task": {
    "id": "orkestrasyon-mimarisi",
    "title": "Orchestration Architecture",
    "goal": "Planlayıcı, yönlendirici ve yürütücünün mimarideki yerini karara bağla; görev ve mesaj sözleşmelerini yaz; çıktıyı docs/mimari/02-ORKESTRASYON.md olarak bırak.",
    "source": "gorevler/bekleyen/2026-09-08-1416-orchestration-architecture.md",
    "created_at": "2026-09-08T14:16:00+03:00",
    "budget": { "max_usd": 6, "on_exceed": "stop", "spent_usd": null },
    "labels": ["faz-3", "mimari"]
  },

  "graph": {
    "steps": [
      {
        "id": "sozlesmeleri-yaz",
        "title": "task.schema.json ve message.schema.json yazılır",
        "assign": { "mode": "role", "role": "specialist" },
        "depends_on": [],
        "inputs": [
          "docs/mimari/00-BLUEPRINT.md",
          "docs/adr/ADR-002-yurutme-ve-iletisim.md",
          "docs/adr/ADR-003-ilerleme-kaydi.md"
        ],
        "writes": ["contracts/task.schema.json", "contracts/message.schema.json"],
        "evaluation": {
          "method": "deterministic",
          "checker": "node arac/sema-dogrula.js --test"
        },
        "retry": { "max_attempts": 2, "mode": "duzelt", "backoff": "yok", "max_critique_items": 8 },
        "side_effects": true,
        "compensation": {
          "method": "Yazılan iki şema dosyası contracts/_eski/ altına taşınır; commit atılmadığı için depo önceki hâline döner.",
          "on_impossible": "human-gate"
        },
        "on_failure": "dur",
        "timeout_s": 1800,
        "human_gate": false
      },
      {
        "id": "belgeyi-yaz",
        "title": "docs/mimari/02-ORKESTRASYON.md yazılır",
        "assign": { "mode": "role", "role": "specialist" },
        "depends_on": ["sozlesmeleri-yaz"],
        "inputs": ["docs/arastirma/i1-orkestrasyon/OZET.md", "docs/03-ANTI-PATTERNLER.md"],
        "writes": ["docs/mimari/02-ORKESTRASYON.md"],
        "evaluation": {
          "method": "deterministic",
          "checker": "node arac/iz-izle.js"
        },
        "retry": { "max_attempts": 2, "mode": "duzelt", "backoff": "yok", "max_critique_items": 8 },
        "side_effects": true,
        "compensation": {
          "method": "Belge docs/_eski/ altına taşınır; yol haritası kutucuğu boş bırakılır.",
          "on_impossible": "human-gate"
        },
        "on_failure": "dur",
        "timeout_s": 1800
      },
      {
        "id": "kapanis",
        "title": "Doğrulama, commit, günlük ve yol haritası işareti",
        "assign": { "mode": "agent", "agent_id": "kanit-denetcisi" },
        "depends_on": ["sozlesmeleri-yaz", "belgeyi-yaz"],
        "inputs": ["step:sozlesmeleri-yaz", "step:belgeyi-yaz"],
        "writes": ["YOL-HARITASI.md"],
        "evaluation": { "method": "deterministic", "checker": "git status --short" },
        "retry": { "max_attempts": 1, "mode": "temiz-sayfa", "backoff": "yok" },
        "side_effects": true,
        "compensation": {
          "method": "Commit atıldıysa geri alınmaz; yanlışlık raporlar/ONAY-BEKLEYENLER.md'ye yazılır ve düzeltme kullanıcının kararıdır.",
          "on_impossible": "human-gate"
        },
        "on_failure": "human-gate",
        "human_gate": false
      }
    ]
  },

  "run": {
    "run_id": "kosu-2026-09-08-1416",
    "started_at": "2026-09-08T14:16:30+03:00",
    "step_records": [
      {
        "step_id": "sozlesmeleri-yaz",
        "attempt": 1,
        "status": "BITTI",
        "started_at": "2026-09-08T14:20:00+03:00",
        "ended_at": "2026-09-08T14:41:00+03:00",
        "result_summary": "İki şema yazıldı; doğrulayıcı üç şemayı da tanıyacak biçimde genişletildi.",
        "artifacts": ["contracts/task.schema.json", "contracts/message.schema.json"],
        "evaluation_result": "GECTI",
        "side_effects_done": ["contracts/task.schema.json yazıldı", "contracts/message.schema.json yazıldı"],
        "cost_usd": null
      },
      {
        "step_id": "belgeyi-yaz",
        "attempt": 1,
        "status": "BASLADI",
        "started_at": "2026-09-08T14:41:10+03:00"
      }
    ]
  }
}
